tweet id,text,created at
702878078234705920,"Pokemon moon 🌛🌜, definitely 😉",2016-02-25 15:29:27+00:00
702878071376969728,Pokemon Sun and Moon's legendaries https://t.co/0pml8hW3I7,2016-02-25 15:29:25+00:00
702878060178059264,Rumor: Pokemon Sun and Pokemon Moon Leaked Before Pokemon Direct https://t.co/jmNHwpZMOz https://t.co/GepwUcSV7H,2016-02-25 15:29:23+00:00
702878056218755072,"If it's true and this is Gen 7... I will be sad, I wanted more Kalos.. But ah well, I want that Pokemon Sun ☀️",2016-02-25 15:29:22+00:00
702878055816159232,"Uh oh, Pokemon Sun &amp; Moon may not be real. Gaming sites getting worked by the Ninlendo parody account although @Nerd_Leaks spotted it first?",2016-02-25 15:29:22+00:00
702878039630290944,"Was ist pokemon moon und sun
Was ist das https://t.co/lndHPhk9gx",2016-02-25 15:29:18+00:00
702878035591176197,POKEMON SUN AND MOON,2016-02-25 15:29:17+00:00
702878033548582913,don't ever talk to me or my pokemon sun again,2016-02-25 15:29:16+00:00
702878015055753223,Sweet mother of god! #Pokemon20 #Pokémonmoon #PokémonSun  https://t.co/AG4p3JtdSu,2016-02-25 15:29:12+00:00
702878003815178240,Leaked screenshots of Pokemon Moon. #Pokemon https://t.co/VQUA1Q4c6Y,2016-02-25 15:29:09+00:00
702878003588698112,#Pokemon #Sun and #Moon Titles and Logos Leaked https://t.co/ZcPw31yXoN #expgeek,2016-02-25 15:29:09+00:00
702877997733453824,Shouldn't decide yet but I would pick pokemon sun version because i can relate more *early risers*,2016-02-25 15:29:08+00:00
702877974341808128,"I liked a @YouTube video from @pdwinnall https://t.co/HPrenRPSWM ""POKÉMON SUN AND MOON"" LEAKED? Trademarks found for TWO NEW POKÉMON",2016-02-25 15:29:02+00:00
702877972873797632,@Nibellion Local outlet IGN Benelux falls for it as well... https://t.co/857PyzYeiK https://t.co/fgNAuCGqze,2016-02-25 15:29:02+00:00
702877966955646976,if pokemon sun/moon is real. can i play with a team of hawlucha and then crush the sun with a flying press?,2016-02-25 15:29:00+00:00
702877948127354880,Every article I've seen talk about Pokemon moon and sun hasn't been reliable in the past. Plus why would we see the English logo before JP?,2016-02-25 15:28:56+00:00
702877940434993152,yo the Pokemon moon logo looks decent tbh  https://t.co/BaiIRclSqD,2016-02-25 15:28:54+00:00
702877920008601601,Pokemon Sun and Moon https://t.co/FaDwnAagL0,2016-02-25 15:28:49+00:00
702877903411920897,Pokemon Sun/Moon possibly new 7th gen: https://t.co/XW6XtPYJlT via @YouTube,2016-02-25 15:28:45+00:00
702877884000575489,Pokemon20th: New Games In The Works (Pokemon Moon &amp; Sun)? https://t.co/plNRLBWMgt https://t.co/EwkwZVohui,2016-02-25 15:28:41+00:00
702877869555490816,"Retweeted Ali-A (@OMGitsAliA):

POKEMON ""SUN"" and ""MOON"" tipped to be announced TOMORROW! HYPEEEEEE! 󾍁󾍘󾬓... https://t.co/oMMhUNfKjX",2016-02-25 15:28:37+00:00
702877867743551488,"Choose well....
FAV for #PokemonSUN
or 
RT for #PokemonMOON 
or both of course :3 https://t.co/A31M7A0M51",2016-02-25 15:28:37+00:00
702877856385204225,Pokemon sun cannot be real the sun is just a fuckin black disc remember https://t.co/tzPGYqIgPL,2016-02-25 15:28:34+00:00
702877853390663680,My video on Pokemon Sun and Moon is almost at 100 views....Awesome!! XD,2016-02-25 15:28:33+00:00
702877853071740928,Nintendo will probably announce Pokemon Sun and Moon tomorrow https://t.co/5j5BNJOr2g https://t.co/GsBd54nL4w,2016-02-25 15:28:33+00:00
702877852174196736,"#pokémon moon and sun more like ""so let's see the graphics for the diamond and pearl remakes""",2016-02-25 15:28:33+00:00
702877851930853377,Well time to save up for Pokémon Sun &amp; Moon 😱😩💸💸💸,2016-02-25 15:28:33+00:00
702877840065306624,"@GameXplain found a rumor
https://t.co/MBcx3wwHW0",2016-02-25 15:28:30+00:00
702877763112452096,POKÉMON SUN AND MOON MEANS WE ARE GETTING A 7TH GEN: https://t.co/FMRLtZy9ok via @YouTube,2016-02-25 15:28:12+00:00
702877753327034370,"Pokémon Sun and Moon leak, trademarked before tomorrow's Direct https://t.co/QiJ55go3Rc #TechnoBuffalo https://t.co/sZFM2I2qnN",2016-02-25 15:28:09+00:00
702877743306940417,CJ Jackson https://t.co/7MRnaYrpXU,2016-02-25 15:28:07+00:00
702877741624983552,"#PokemonSun and #PokemonMoon may be just around the corner! #Pokemon20 

https://t.co/76dZFfNiP6 https://t.co/8BJOycW5ZP",2016-02-25 15:28:07+00:00
702877731365785600,actually Pokemon Sun and Moon are fake. Tomorrow is all about the new Pokemon detective game. Danny Devito as Pikachu confirmed.,2016-02-25 15:28:04+00:00
702877727305519108,@Patterrz Why no Artemis in Pokemon Moon?,2016-02-25 15:28:03+00:00
702877709668642816,Nintendo will probably announce Pokemon Sun and Moon tomorrow: One day before Nintendo is… https://t.co/nu7nwgmY7t,2016-02-25 15:27:59+00:00
702877696687144960,POKEMON SUN AND MOON???? WILL WE GET SOLROCK AND LUNATONE EVOS????,2016-02-25 15:27:56+00:00
702877694749376512,@UnlistedLeaf ANDO! POKEMON SUN &amp; MOON! https://t.co/BBmtCn05fb,2016-02-25 15:27:55+00:00
702877686406864896,POKEMON SUN AND MOON THO???? AYYYYYYY GEN 7 IS HERE :D,2016-02-25 15:27:53+00:00
702877653683052544,I liked a @YouTube video from @numbnexus https://t.co/THuKA8THzi UHH SO NEW POKEMON MOON &amp; SUN GAMES TRADEMARKED WHAT DOES THIS MEAN?,2016-02-25 15:27:46+00:00
702877649597812736,Pokémon Sun and Moon?? hoping it'll be confirmed tomorrow #NintendoDirect,2016-02-25 15:27:45+00:00
702877640341000192,"Sun and Moon is such a dumb title lol, but i'll get over it. #PokemonSun",2016-02-25 15:27:42+00:00
702877638117830657,@P0KEG0DMars (1/2) No ways I still put my bet on gen 6.5 . Pokemon Moon/Sun logo look too ugly to be true . It's just look like a fan-made,2016-02-25 15:27:42+00:00
702877628823371776,"I think if I have to choose, I'll go Pokemon Moon. Because I'm pretty good at arsing up.",2016-02-25 15:27:40+00:00
702877627363659776,"Pokemon Sun and Moon. It seems so wrong.

Solrock and Lunatone/Cresselia cover?",2016-02-25 15:27:39+00:00
702877619319021568,I'll be getting Pokemon Moon because it looks better and I bet it has better exclusive locations.,2016-02-25 15:27:37+00:00
702877614621519872,"So, should we go with #PokemonSun or #PokemonMoon?  Still completely hypothetical information.
#PokemonDirect 
https://t.co/2GvKeH7oOs",2016-02-25 15:27:36+00:00
702877594639867904,So do I get my dianamon early if I go with Pokemon Moon?,2016-02-25 15:27:32+00:00
702877592244846592,Pokémon Moon Outsells Sun 2-To-1 Based Purely On The 🌙 Tumblr Witch 🌙 Demographic,2016-02-25 15:27:31+00:00
702877584879689729,#PokemonSun and #PokemonMoon Leaked By Trademark Registration: https://t.co/UnrmofStVE - via:@vgugaming #nintendo #retrogaming #gamefreak,2016-02-25 15:27:29+00:00
702877581327114240,@doctor_cupcakes @ssf1991 So Detective Pikachu is the prequel to Pokemon Moon/Sun?,2016-02-25 15:27:28+00:00
702877553539715072,Tomorrow we find out about our new POKEMON! :D &lt;3 &lt;3 &lt;3 https://t.co/9B5Ewdd0JV,2016-02-25 15:27:22+00:00
702877531595264000,"Also if pokemon sun is the real title, calling sun cover legend Ra.",2016-02-25 15:27:17+00:00
702877524091482112,Pokemon Moon confirmed! https://t.co/r9NzrENXQV,2016-02-25 15:27:15+00:00
702877518689206274,"Do I think it's real, yes. Do I want it to be real, yes. Which one would you get? https://t.co/JHVxdkJxKi #Pokemon #direct #pokemon20 #rumor",2016-02-25 15:27:13+00:00
702877505187778560,pokemon moon and sun. .. those names could lead to some nifty themes but i'm not hoping Too high,2016-02-25 15:27:10+00:00
702877496602181633,"Nintendo starts to sweat as they check social media while preparing to discuss their new game, Pokemon sun and moon",2016-02-25 15:27:08+00:00
702877484476440576,"@Junichi_Masuda A Pokemon Moon game?
Like with Clefairy?",2016-02-25 15:27:05+00:00
702877455003086848,@Nicktendowii so Pokemon sun and moon are floating around the interwebs. Does that mean Pokemon eclipse will be the joint game? #Pokemon #,2016-02-25 15:26:58+00:00
702877451848777728,"The new Pokemon will evolve Solrock and Lunatone ito Mega Solrock Lunatone. Get gt? Cause it was called Pokemon Sun &amp; Moon....

Fuck you.",2016-02-25 15:26:58+00:00
702877432500473856,FREAKING OUT SO BADLY RIGHT NOW FOR POKEMON SUN AND MOON,2016-02-25 15:26:53+00:00
702877424409812992,POKEMON SUN AND MOON 😍 can't wait,2016-02-25 15:26:51+00:00
702877405946515456,"Pokémon Sun/Moon? Maybe. Well, whatever they want to tell us, I can't wait.  https://t.co/Gp9z3m6WSY",2016-02-25 15:26:47+00:00
702877401647337472,Pokemon Sun and Moon Trademarked!!!: https://t.co/PGIy5VLWON via @YouTube,2016-02-25 15:26:46+00:00
702877396223942657,"THE POKEMON SUN &amp; MOON MEMES NEED TO STOP

MY TIMELINE IS FULL OF THEM.",2016-02-25 15:26:44+00:00
702877391681622016,Man I'll have a hard giggle if Pokemon Sun and Moon weren't the big announcement... then the leaks have beaten those who believed..,2016-02-25 15:26:43+00:00
702877370286473216,"Excited to see what Nintendo have in store for us Pokemon wise tomorrow, praying that the Pokemon Sun and Moon rumours are legit.",2016-02-25 15:26:38+00:00
702877364699717633,Pokémon 'Sun' and 'Moon' should debut on February 26th https://t.co/8unZASmQwM https://t.co/U7yCPMDG9c https://t.co/pAEDQgIlTr,2016-02-25 15:26:37+00:00
702877358760534016,"I'm weirded out as hell by all this. Literally like three months after Pokemon Sun and Moon appear in Player Two Start, they show up IRL.",2016-02-25 15:26:35+00:00
702877318210064385,NEW POKEMON GAME! POKEMON SUN AND MOON INFO LEAKED: https://t.co/rTK95JWh3y via @YouTube,2016-02-25 15:26:26+00:00
702877311763402752,pokemon sun &amp; moon would actually be kinda nice imo... my sis was like mega lunatone &amp; solrock confirmed,2016-02-25 15:26:24+00:00
702877302288420864,SO WHATS THIS I SEE ABOUT POKEMON SUN AND MOON??? HELLO HYPE AF RN XD,2016-02-25 15:26:22+00:00
702877275931291648,Pokemon Sun and Moon Listed - Report - GameSpot https://t.co/P1eqijhGzC #Tech https://t.co/oxGVcLwHez,2016-02-25 15:26:16+00:00
702877272965935105,Pokémon 'Sun' and 'Moon' should debut on February 26th https://t.co/hOi3Tcxmt7,2016-02-25 15:26:15+00:00
702877261234462720,Pokemon Sun and Moon Listed - Report - GameSpot https://t.co/HjY2v7ImMj https://t.co/tNjDqgLuZn,2016-02-25 15:26:12+00:00
702877258323636224,Pokemon Sun and Moon Listed - Report - GameSpot https://t.co/rPQaeaGmm3 #Tech https://t.co/nxinGK8U8Y,2016-02-25 15:26:11+00:00
702877255828045824,This is interesting! Nintendo will probably announce Pokemon Sun… https://t.co/A6EB7JQYzB https://t.co/wTJBcOCdfa https://t.co/C3Dext38yg,2016-02-25 15:26:11+00:00
702877246193684480,#GTP_Social Pokemon Sun and Moon Listed - Report - GameSpot https://t.co/O4TeRCNqfz @GoogNewsTech https://t.co/moIHi3RKa8,2016-02-25 15:26:08+00:00
702877245333843968,Pokemon Sun and Moon Listed - Report - GameSpot https://t.co/VgHIip6Hrg,2016-02-25 15:26:08+00:00
702877230729396225,pokemon sun and moon *o* .. SM,2016-02-25 15:26:05+00:00
702877218108809216,"I liked a @YouTube video from @pdwinnall https://t.co/93j4QeOQGH ""POKÉMON SUN AND MOON"" LEAKED? Trademarks found for TWO NEW POKÉMON",2016-02-25 15:26:02+00:00
702877214333759490,"Thanks Europe.
https://t.co/qJx0nBKtKD https://t.co/LukNOwfJUK",2016-02-25 15:26:01+00:00
702877205735587840,The Pokemon Sun and Pokemon Moon trademarks look fake.,2016-02-25 15:25:59+00:00
702877204103835648,@TheJWittz Can we expect a #pokemonsunmoon video later today? And what the hell happened to #PokemonZ?,2016-02-25 15:25:58+00:00
702877197414109184,"if there was an actual Pokemon Sun and Pokemon Moon, it'd be the first time I'd HAVE to own both games",2016-02-25 15:25:57+00:00
702877177247895552,@RogersBase GEN 7 TITLES!!!??? https://t.co/6XTbtm3bvE,2016-02-25 15:25:52+00:00
702877147267002368,Not gonna lie kinda digging those #PokemonSun and #PokemonMoon logos,2016-02-25 15:25:45+00:00
702877134289764354,Will #Pokemon Sun/Moon be announced tomorrow? https://t.co/AxsZQ0a9k2,2016-02-25 15:25:42+00:00
702877123149565952,Biggest reason Pokémon might skip 3rd game? If their next games were flagship titles for NX https://t.co/0BuJFe9HCG https://t.co/yvS9PPnPJx,2016-02-25 15:25:39+00:00
702877121249714177,"pokemon sun and moon
leona what have you done",2016-02-25 15:25:39+00:00
702877115767791616,Pokemon Sun and Moon Listed - Report - GameSpot https://t.co/xYHHZc33j5 #technology Pokemon Sun and Moon Listed - Report - GameSpot,2016-02-25 15:25:37+00:00
702877109023346688,@BasedLaRock Pokemon Sun and Moon revealed today https://t.co/nKLWCDB522,2016-02-25 15:25:36+00:00
702877106829660160,How funny would it be if it wasn't Pokemon Sun and Moon?,2016-02-25 15:25:35+00:00
702877091067510785,Pokémon 'Sun' and 'Moon' should debut on February 26th https://t.co/CUEoPwyMfD,2016-02-25 15:25:31+00:00
702877087443476481,Pokémon Sun and Moon trademarks pop up a day before Nintendo Direct https://t.co/3rDe0sv8zZ,2016-02-25 15:25:31+00:00
702877084213903360,"I promise if this isn't confirmed tomorrow I'm going to lick my cat bruh... Ignf

#PokemonSun #PokemonMoon",2016-02-25 15:25:30+00:00
702877078509719552,Pokemon Sun &amp; Moon (not confirmed) but most likely being announced tomorrow during the Pokemon Direct! #pokemon20 https://t.co/JZdus7CqZ0,2016-02-25 15:25:28+00:00
702877055017332737,Pokémon 'Sun' and 'Moon' should debut on February 26th https://t.co/r0VbSY13mJ,2016-02-25 15:25:23+00:00
702877052865740800,pokemon sun/moon spoilers https://t.co/ylxu8i6Z5D,2016-02-25 15:25:22+00:00
702877052664356868,"Nintendo will probably announce Pokemon Sun and Moon tomorrow, via Techradar - All the latest technology news... https://t.co/ibd9aEDFeq",2016-02-25 15:25:22+00:00
702877051091419136,Pokemon Sun &amp; Moon. Definitely hyped. https://t.co/EUSBsTYvqd,2016-02-25 15:25:22+00:00
702877049707433984,The hype is real! #pokemonsun #pokemonmoon #pokemon #7thgen #Nintendo #nintendodirect Watch the… https://t.co/jLD4Ekg2rt,2016-02-25 15:25:22+00:00
702877045282443264,"Hu so
The Pokemon Sun/Moon got leaked bc Nintendo got them to the EU trademark thingy",2016-02-25 15:25:21+00:00
702877042312761345,Pokémon 'Sun' and 'Moon' should debut on February 26th https://t.co/sZtADhwlsV,2016-02-25 15:25:20+00:00
702877039536291840,Pokémon 'Sun' and 'Moon' should debut on February 26th https://t.co/v7Xbvn8aZH,2016-02-25 15:25:19+00:00
702877003117043713,Pokémon 'Sun' and 'Moon' should debut on February 26th https://t.co/17iXXAG2Y9,2016-02-25 15:25:11+00:00
702877001166798850,Pokemon Sun or Moon... if that is real... Moon I am by your side uvu,2016-02-25 15:25:10+00:00
702876989548576773,"Pokemon Sun and Moon?

...I swear to god if there's medal collecting and a Werepika...",2016-02-25 15:25:07+00:00
702876988890091520,Pokemon Sun and Pokemon Moon introducing legendary Primal Lunatone and Primal Solrock.... come again?,2016-02-25 15:25:07+00:00
702876968677564417,Pokémon 'Sun' and 'Moon' should debut on February 26th https://t.co/eSZ0Fc7jTE,2016-02-25 15:25:02+00:00
702876967171829760,pokemon sun and moon.......................,2016-02-25 15:25:02+00:00
702876963724259329,[LEAK] Pokemon Sun and Pokemon Moon leaked ahead of tomorrow's Nintendo Direct https://t.co/4a0ETmDouO https://t.co/3lJMSU4Joa,2016-02-25 15:25:01+00:00
702876961572413440,I can't choose between Pokémon Sun or Moon. 😔🌚🌞,2016-02-25 15:25:01+00:00
702876957269213184,pokemon sun and moon wont come out in the UK because sun and moon dont exist here. instead we will get pokemon cloud,2016-02-25 15:25:00+00:00
702876955712991232,Pokémon 'Sun' and 'Moon' should debut on February 26th https://t.co/KETI0S2cyF,2016-02-25 15:24:59+00:00
702876942710628352,Pokémon 'Sun' and 'Moon' should debut on February 26th https://t.co/EgkPiRlmlC,2016-02-25 15:24:56+00:00
702876925790806018,@TyranitarTube can't wait for pokemon sun and moon,2016-02-25 15:24:52+00:00
702876924717170688,"Watch them make Growlithe and Arcanine Pokemon Sun exclusive....

#DecisionsDecisions
#TeamMoon",2016-02-25 15:24:52+00:00
702876923722993665,"Honestly I don't think those Pokemon Sun and Moon logos are legit. I mean, they might still be, who knows",2016-02-25 15:24:52+00:00
702876883818582016,Pokemon Sun and Pokemon Moon to be announced at next Nintendo Direct? Working to get a reaction podcast up for the Poke fans out there.,2016-02-25 15:24:42+00:00
702876862003818496,Pokémon 'Sun' and 'Moon' should debut on February 26th: The Pokémon video game series is turning 20 this... https://t.co/J7uJAKnhXE #tech,2016-02-25 15:24:37+00:00
702876856312164353,Pokemon Sun and Moon! #FeelSoMoon @AH_Michael https://t.co/3SZcUVxjbF,2016-02-25 15:24:36+00:00
702876848682827777,Pokemon sun and moon?????,2016-02-25 15:24:34+00:00
702876843356069888,"Gotta say, (if this is real, most likely) I love the names. #pokemonsun #pokemonmoon",2016-02-25 15:24:32+00:00
702876836460687360,"Pokemon Sun &amp; Moon are fine but if I dont have anything new about Pokemon Go tomorrow, I may lose it.",2016-02-25 15:24:31+00:00
702876835407753218,@EtikaWNetwork I cant even take that name seriously. I mean Pokemon Sun and Moon edition aha,2016-02-25 15:24:31+00:00
702876833453371397,Here is that #PokemonSUN &amp; #PokemonMOON 100% prove ;) https://t.co/6Nteu1I8RP,2016-02-25 15:24:30+00:00
702876829263257601,[LEAK] Pokemon Sun and Pokemon Moon leaked ahead of tomorrow's Nintendo Direct https://t.co/7UlZsU0qsU,2016-02-25 15:24:29+00:00
702876816021680129,Pokemon sun and moon......,2016-02-25 15:24:26+00:00
702876806781620224,"the first set of Gen 7 games? maybe 

https://t.co/lo1avST1j9",2016-02-25 15:24:24+00:00
702876800188346368,Definitely gonna get #PokémonMoon,2016-02-25 15:24:22+00:00
702876782433853440,@UnlawfulExile Meant to vote for Pokemon Moon because I'm a big fan of both Slyveon and Cresselia and Gardevior so yeah #teammoon :],2016-02-25 15:24:18+00:00
702876767523102720,I liked a @YouTube video from @sebbsebb27 https://t.co/es0CkUklg8 Pokemon Sun And Moon Trademarked By Nintendo!!,2016-02-25 15:24:14+00:00
702876752515887105,Are you going to buy Pokemon Sun or Pokemon Cha? #Pokemon #PokemonSun #PokemonDirect https://t.co/8wyh0NQEbq,2016-02-25 15:24:11+00:00
702876736678027264,The hype is real! Pokemon Sun and Moon announcement has been leaked 2 days early. So much for keeping news under wraps in this day in age.,2016-02-25 15:24:07+00:00
702876722761494528,"New Pokemon Game Announced???!!! 
Pokemon Moon and Sun
What do you think? https://t.co/93C27QwMKv",2016-02-25 15:24:04+00:00
702876694042927105,@KGPrestige Pokemon sun and moon is fake they showed a picture of Nintendo announcing it but then I check and they haven't announced it yet,2016-02-25 15:23:57+00:00
702876668080340998,POKEMON SUN AND POKEMON LEAKED - New Pokemon Games Coming https://t.co/jakH8Gm0oZ #androidgames #gameinsight #android,2016-02-25 15:23:51+00:00
702876649130315777,Donde esta tacoman para hacer el first view de Pokemon Sun and Moon?,2016-02-25 15:23:46+00:00
702876646420959233,"guys there haven't been any official pokemon moon/sun announcements, only hoaxes and rumors so far",2016-02-25 15:23:45+00:00
702876609011912704,@MrDalekJD pokemon sun and moon confirmed,2016-02-25 15:23:37+00:00
702876594877157376,"Pokemon Sun and Moon. I doubt its basically another blue and kinda orange,red based on the logo work idk i just doubt",2016-02-25 15:23:33+00:00
702876579064647680,"[Two months after release of Pokémon Sun/Moon.]
""WHEN IS COMET COMING?!?!""",2016-02-25 15:23:29+00:00
702876573817556992,"Some people seem annoyed by Pokémon Sun and Moon leaking, but I'm personally excited to see what we see tomorrow now.",2016-02-25 15:23:28+00:00
702876540716097536,I liked a @YouTube video https://t.co/2tNbHyZGmb Pokemon Sun and Moon LEAKED?! NEW POKEMON GAMES?,2016-02-25 15:23:20+00:00
702876529475325952,@cuteyhoneyflash pokemon moon and pokemon sun got leaked,2016-02-25 15:23:18+00:00
702876521745113091,Pokémon Sun and Moon?!?!?!! 👀 please Lordt let it be real and let it be set in South America. I've wanted that for so long.,2016-02-25 15:23:16+00:00
702876510911385600,@cuteyhoneyflash there was a leak of 2 trademarks called pokemon sun and pokemon moon,2016-02-25 15:23:13+00:00
702876507253968896,I liked a @YouTube video from @numbnexus https://t.co/yAEoUgDrZd UHH SO NEW POKEMON MOON &amp; SUN GAMES TRADEMARKED WHAT DOES THIS MEAN?,2016-02-25 15:23:12+00:00
702876499276333056,Ngl Pokemon Moon and Sun sound pretty dope!,2016-02-25 15:23:10+00:00
702876496998731776,Nintendo will probably announce Pokemon Sun and Moon tomorrow https://t.co/4qnTVLi7q9 #TechNews,2016-02-25 15:23:10+00:00
702876489599946753,Pokémon 'Sun' and 'Moon' should debut on February 26th https://t.co/jBJRg3eP1Q,2016-02-25 15:23:08+00:00
702876487741902848,FIRST #PokemonSun and #PokemonMoon Pokemon CONFIRMED #7GenHype #Pokemon20 #PokemonDirect https://t.co/AL2kAbkAPk,2016-02-25 15:23:08+00:00
702876487087685632,#Pokemon Sun &amp; Moon To Be Revealed Tomorrow (via @Kotaku) https://t.co/lBJJasEdiL https://t.co/59ZECH5GZa,2016-02-25 15:23:07+00:00
702876484369780738,Pokemon Sun and Moon Listed - Report https://t.co/jCX0G1Q1Cf #gaming https://t.co/kqBrRzqInV,2016-02-25 15:23:07+00:00
702876482520002560,Pokemon Sun and Moon Listed - Report - GameSpot https://t.co/0tyTBwg83j https://t.co/Kg4dNYsuiz,2016-02-25 15:23:06+00:00
702876481119064064,"Pokemon Sun and Moon does sound legit, and I HAVE been craving Gen 7. We'll see tomorrow I suppose *fingers crossed*",2016-02-25 15:23:06+00:00
702876469882523648,"Pokemon Sun and Moon, coming soon, this is a real thing",2016-02-25 15:23:03+00:00
702876431718584320,Hopefully Pokemon Sun and Moon is set in Australia. Instead of gym badges you get Coopers bottlecaps.,2016-02-25 15:22:54+00:00
702876408259940352,Leak! #Pokemon Sun and Moon getting announced at tomorrow's #PokemonDirect. But wait until tomorrow to confirm this. https://t.co/W8e17wnlQA,2016-02-25 15:22:49+00:00
702876406372540416,POKEMON SUN AND POKEMON LEAKED - New Pokemon Games Coming https://t.co/f7oGRf03Hr #androidgames #gameinsight #android #followmejp #followb…,2016-02-25 15:22:48+00:00
702876404472487937,3Novices:Pokémon 'Sun' and 'Moon' should debut on February 26th https://t.co/tMflH71rdH The Pokémon video game series is turning 20 this w…,2016-02-25 15:22:48+00:00
702876397610672128,"so, what're you all siding with? #PokemonSun or #PokemonMoon? #Pokemon #PokemonDirect",2016-02-25 15:22:46+00:00
702876358087675904,Pokémon 'Sun' and 'Moon' should debut on February 26th https://t.co/zOWKADIkmo https://t.co/TLiGELNWdG,2016-02-25 15:22:37+00:00
702876342291927041,Everyone's going to get Pokemon Sun. I'm calling it right now. PRAISE THE SUN,2016-02-25 15:22:33+00:00
702876287191248900,"really? icon looks hoax tho ""Pokémon Moon And Sun Logos Pop Up"" https://t.co/wRveni846e",2016-02-25 15:22:20+00:00
702876278790160385,New: Nintendo will probably announce Pokemon Sun and Moon tomorrow https://t.co/YcvdQIlfIc,2016-02-25 15:22:18+00:00
702876255398408192,If Pokemon Sun and Moon is a thing you best know im going to be playing Pokemon Moon,2016-02-25 15:22:12+00:00
702876251493691392,I haven't seen any official tweets about pokemon sun and moon but I assume it was on the pokemon direct?? I should probably watch those.,2016-02-25 15:22:11+00:00
702876238432509952,Pokemon Sun and Pokemon Moon? Wow.,2016-02-25 15:22:08+00:00
702876237799235585,Looks like we found out about the new games a day early :D #PokemonSun #PokemonMoon,2016-02-25 15:22:08+00:00
702876233885855744,@IndayKlaire Yea.. O.o I'm shock too. Haha https://t.co/c2lvtleuOC,2016-02-25 15:22:07+00:00
702876229431664641,I liked a YouTube video from numbnexus https://t.co/v4KfC1WT8j UHH SO NEW POKEMON MOON &amp; SUN GAMES TRADEMARKED WHAT DOES THIS MEAN?,2016-02-25 15:22:06+00:00
702876187714932736,"Sun &amp; Moon
Day &amp; Night
Ying &amp; Yang
Black &amp; White

UNOVA CONFIRMED #PokemonMoon #PokemonSun",2016-02-25 15:21:56+00:00
702876173869535232,"So if the current rumors are true, who else is preordering Pokemon Moon",2016-02-25 15:21:53+00:00
702876162440220672,So there's rumors about #Pokémon Sun and Moon being in development where's Pokémon Mars Bar and Milky Way?,2016-02-25 15:21:50+00:00
702876158723948544,Pokemon Sun and Moon trademark information leaked! What's this? Gen 7 is about 'who is best princess'? https://t.co/NBlVNgRken,2016-02-25 15:21:49+00:00
702876147449733120,And Eurogamer too. https://t.co/UGeRVtZsiR https://t.co/EHsc925MDC,2016-02-25 15:21:47+00:00
702876121235398656,Wait so is Pokemon Sun and Moon fake or undecided ?,2016-02-25 15:21:40+00:00
702876114251882496,"If this Pokémon Sun and Moon thing is real, prepare for all the Sailor Moon and MLP jokes",2016-02-25 15:21:39+00:00
702876110099488769,Nintendo will probably announce Pokemon Sun and Moon tomorrow https://t.co/RXL8SYnvBU,2016-02-25 15:21:38+00:00
702876108916711424,"This ""Pokemon Moon"" and ""Pokemon Sun"" seems too good to be true
...
Oh well, at least the logos are pretty :3",2016-02-25 15:21:37+00:00
702876100137889797,What is this I'm hearing about Pokémon Sun and Moon now?,2016-02-25 15:21:35+00:00
702876096669335554,I liked a @YouTube video from @twintendo_ https://t.co/8zot66IsIi POKÉMON SUN &amp; MOON TRADEMARKS FOUND - 7TH GEN GAMES LEAKED?,2016-02-25 15:21:34+00:00
702876094848839680,LIKE WHAT THE SHIT POKEMON SUN AND MOON OMG,2016-02-25 15:21:34+00:00
702876070547054592,#PokemonSun and #PokemonMoon???!?!!!?! LETS GO I CANT WAIT FOR TOMORROW,2016-02-25 15:21:28+00:00
702876065614733312,Pokémon 'Sun' and 'Moon' should debut on February 26th https://t.co/LHilSnQvmr #AppleNews,2016-02-25 15:21:27+00:00
702876064993972224,Lol really Nintendo ...... sun and moon -_- https://t.co/gMCrVSEZnm,2016-02-25 15:21:27+00:00
