tweet id,text,created at
703006537342562304,@nibelheirn POKEMON SUN AND MOON I CANT BELIEVE THERE IS A POKEMON GAME ABOUT US,2016-02-25 23:59:54+00:00
703006532129021952,If Pokemon sun and moon are just a giant joke tomorrow I'm not sure if I'll laugh or cry,2016-02-25 23:59:53+00:00
703006522914295808,Theory: the opening to Pokemon Sun is just the song “The Sun is a Mass of Incandescent Gas.”,2016-02-25 23:59:50+00:00
703006371894067200,Pokemon Sun and Moon will have different amounts of content due to the Sun being larger than the Moon.,2016-02-25 23:59:14+00:00
703006360166866944,Overheard: Villainous team in Pokémon Sun: WE WANT IT TO BE SUNNY ALL DAY ALL THE TIME. Villainous team in... https://t.co/kvZgNwA2sU,2016-02-25 23:59:12+00:00
703006347374137344,"If pokemon sun and moon are a thing, I might actually get Moon. I haven't bought a pokemon game since LeafGreen",2016-02-25 23:59:09+00:00
703006326507511809,"@TyranitarTube It's today !!!#PokemonSun#PokemonMoon",2016-02-25 23:59:04+00:00
703006291040591872,Proof: Pokémon SUN &amp; MOON might be MISDIRECTION - feliscybernicus: There’s been a lot of speculation about... https://t.co/K0RMirdPQr,2016-02-25 23:58:55+00:00
703006233033314305,Definitely getting Pokemon Sun over Moon,2016-02-25 23:58:41+00:00
703006212846194688,I wonder if @AZEALIABANKS is excited for the new Pokemon Sun &amp; Pokemon Moon games. ARE YOU!?,2016-02-25 23:58:37+00:00
703006133158551553,OMGGGG @ZombieObed LOOOK https://t.co/IM3IJjn8Gf,2016-02-25 23:58:18+00:00
703006127320125440,I'm kind of disappointed that Pokemon sun and moon weren't a surprised. (If it's true) 😔 #PokemonMoon #PokemonSun,2016-02-25 23:58:16+00:00
703006099453014016,GS News - World of Tanks Developer Becomes Billionaire; New Pokemon Sun and Moon Games; Resident Evil Re-Releases https://t.co/GqVVBfNGG9,2016-02-25 23:58:09+00:00
703006096730906624,#gaming #gamer GS News - World of Tanks Developer Becomes Billionaire; New Pokemon Sun ... https://t.co/V8qSEpMSmN https://t.co/mdp7BdwsZ3,2016-02-25 23:58:09+00:00
703006085183987712,GS News - World of Tanks Developer Becomes Billionaire; New Pokemon Sun and Moon Games; Resident Evil Re-Releases:  The video game in...,2016-02-25 23:58:06+00:00
703006079559401472,#gamedev #GAME GS News - World of Tanks Developer Becomes Billionaire; New Pokemon Sun and M... https://t.co/4yJY5qeIpu #technology #tech,2016-02-25 23:58:05+00:00
703006077843955712,#gamedev #GAME GS News - World of Tanks Developer Becomes Billionaire; New Pokemon Sun and M... https://t.co/42g9zhv1c9 #technology #tech,2016-02-25 23:58:04+00:00
703006076040404992,GS News - World of Tanks Developer Becomes Billionaire; New Pokemon Sun and Moon Games; Resident Evil Re-Relea... https://t.co/5Q76hQHABE,2016-02-25 23:58:04+00:00
703006073834250240,GS News - World of Tanks Developer Becomes Billionaire; New Pokemon Sun and Moon Games; Resident Evil Re-Releases https://t.co/Ga2nJEzyrK,2016-02-25 23:58:03+00:00
703006071875502081,GS News - World of Tanks Developer Becomes Billionaire; New Pokemon Sun and Moon Games; Resident Evil Re-Relea... https://t.co/F3S2qrB1sA,2016-02-25 23:58:03+00:00
703006055689809920,@strongest_human Pokemon Moon versus Pokemon Boobs rivalry breaks out on the streets.,2016-02-25 23:57:59+00:00
703006013318823936,GS News - World of Tanks Developer Becomes Billionaire; New Pokemon Sun and Moon Games; Resident Evil Re-Releases https://t.co/qLuqOefnkZ,2016-02-25 23:57:49+00:00
703006001474117632,Playstation 3 GS News - World of Tanks Developer Becomes Billionaire; New Pokemon Sun and Moon Games; Resi... https://t.co/8jWLiefkz6 ps3,2016-02-25 23:57:46+00:00
703005991504367620,"📷 thejewelboss: Everyone is jumping on the Pokémon sun and moon train, but this shit isn’t even... https://t.co/NzvtrsCtwZ",2016-02-25 23:57:44+00:00
703005990892015620,It'd be cool if Pokemon Sun/Moon had amiibo support where tapping a poke gets a pokemon with an exclusive move it can breed down,2016-02-25 23:57:44+00:00
703005986907430912,"Thoughts on the Pokemon Sun/Moon unverified leaks- I'm always cool with the possibility of new main-story Pokemon games, but it'd be weird-",2016-02-25 23:57:43+00:00
703005946038063107,"""Yeah sorry I can't come into work today, I'm having an episode because Nintendo just announced Pokemon Sun and Moon. See you next week.""",2016-02-25 23:57:33+00:00
703005909887393792,@chaceRider Also pokemon sun and moon are gone be a thing :D *vibrates*,2016-02-25 23:57:24+00:00
703005838307401733,"July 2015 Never Forget !!  @_@
#pokemon20 #pokemonsun #pokemonmoon https://t.co/IsqbhyAI8A",2016-02-25 23:57:07+00:00
703005836574982146,They should have a giant moon pokemon crashing towards Earth in the new #Pokemon Moon. That hasn't been done before.,2016-02-25 23:57:07+00:00
703005830686384134,"Enjoyed watching ""Pokémon Sun and Moon TRADEMARKED with Logos"" https://t.co/u7Y7zZpzGM via @YouTube",2016-02-25 23:57:05+00:00
703005785207545857,@Fairy__Friend also did you here about Pokemon sun and Pokemon moon getting leaked?,2016-02-25 23:56:55+00:00
703005746292600832,@RonFunches Dude! Pokemon Sun and Pokemon Moon...,2016-02-25 23:56:45+00:00
703005731302330368,"Here we go: 

Pokemon Sun and Moon: the 7th Generation.

 Tomorrow. It's coming.",2016-02-25 23:56:42+00:00
703005716655681536,By the name alone I think I will go for Pokemon Moon. We'll see tomorrow,2016-02-25 23:56:38+00:00
703005701191438336,So many different accounts have been tweeting that fake pokemon moon and sun stuff that now I'm not sure if it's actually real or not,2016-02-25 23:56:35+00:00
703005637966434305,shockachu: It’s not even a question which version I’ll pick when Pokemon Sun And Moon come out. It’ll be... https://t.co/gQG8m3K9Zm,2016-02-25 23:56:19+00:00
703005570249265152,"Pokemon sun and Moon... Better than ""julury"" I guess",2016-02-25 23:56:03+00:00
703005544827658240,Pokemon Moon and Pokemon Sun leaked tho. I havent even finished Omega Ruby. 😩,2016-02-25 23:55:57+00:00
703005515572326401,What??? Pokemon Sun &amp; Moon???? What????,2016-02-25 23:55:50+00:00
703005514242748418,wait pokemon sun and moon was a real thing??? I THOUGHT THE EMOJI THING WAS A JOKE,2016-02-25 23:55:50+00:00
703005466654212100,Pokemon Sun and Moon. All of my yes. I need Pokemon in my life,2016-02-25 23:55:39+00:00
703005441526210560,Can the legendary for pokemon moon just be a giant majestic werewolf?,2016-02-25 23:55:33+00:00
703005362207588352,"I actually like Pokemon Sun and Pokemon Moon, I'm really interested now.",2016-02-25 23:55:14+00:00
703005296646459396,"If Pokemon Sun and Moon do get abbreviated to S&amp;M, I'm going to have to choose Moon. Everyone know what S&amp;M really stands for, and I'm an M.",2016-02-25 23:54:58+00:00
703005237263654913,"If you somehow missed the Pokemon Sun and Moon leak, here you go 
https://t.co/hJJDHAB5wp #Pokemon",2016-02-25 23:54:44+00:00
703005233060794370,"ah yes the new pokemon games
pokemon sun and pokemon hip",2016-02-25 23:54:43+00:00
703005229000892416,pokemon moon &amp; sun? *When The Day Met The Night plays softly*,2016-02-25 23:54:42+00:00
703005228556156929,"https://t.co/KVHAry2Zft and https://t.co/beDi8KjJiB both forward.

Fingers crossed for #amiibo support...? https://t.co/oiezcGoHpD",2016-02-25 23:54:42+00:00
703005220524134400,"If Pokemon Moon is legit...

UMBREON POWERRRRRRR",2016-02-25 23:54:40+00:00
703005212974387200,"superrobert: If Pokemon Sun &amp; Moon is real, we’ll all be saying Pokemon S&amp;M and idk how to feel about that... https://t.co/evgZG9X5td",2016-02-25 23:54:38+00:00
703005160998617088,@MyNintendoNews not surprising. It's pretty clear that Pokemon Sun and Moon are real now.,2016-02-25 23:54:26+00:00
703005101171064834,WILL POKEMON SUN AND MOON BE REVEALED OFFICIALLY TOMORROW?! https://t.co/DigZOqtVdd,2016-02-25 23:54:11+00:00
703005098356678656,"elder-fairy: So the ‘supposed’ new Pokemon games are called Pokemon Sun and Pokemon Moon. Altogether, we... https://t.co/fCHY12G9Pl",2016-02-25 23:54:11+00:00
703005050998800386,Are you a day or night person......? https://t.co/sodnKmwLBm,2016-02-25 23:54:00+00:00
703004903388508160,"As for me, I'm going lunar. #PokemonMoon",2016-02-25 23:53:24+00:00
703004892017795072,"Okay, I'm prepared for tomorrow because it'll be the day that Pokemon Sun &amp; Moon gets shown for the first time",2016-02-25 23:53:22+00:00
703004837521158144,aricastiel: So let’s say Pokemon Sun and Moon were actually the real deal and the ones that are going to... https://t.co/450Olr35ce,2016-02-25 23:53:09+00:00
703004825743552512,"Pokemon Sun and Pokemon Moon leaked through trademark filings: https://t.co/HZghLYQ8cY
@OriginalTripleA @GrimCels 
#Pokemon #Nintendo",2016-02-25 23:53:06+00:00
703004752620040193,"Republican debate, Pokemon Sun and Moon, Eddie Aikau, ...",2016-02-25 23:52:48+00:00
703004752611643392,"Currently Trending: Republican debate, Pokemon Sun and Moon, Eddie Aikau, ...  on Google Search.",2016-02-25 23:52:48+00:00
703004752498458625,"Republican debate
  Pokemon Sun and Moon
  Eddie Aikau
  Joe Johnson
  Chrissy Teigen
  Butch Jones
  American...  https://t.co/RXzXrKgdVO",2016-02-25 23:52:48+00:00
703004752263557120,"MexTraxx - Republican debate, Pokemon Sun and Moon, Eddie Aikau, ...: Republican debate
  Pokemon Sun and Moon
  E...  - We track for you",2016-02-25 23:52:48+00:00
703004663629680640,I liked a @YouTube video from @siivagunner https://t.co/P6nhl4g0bR Direct Reveal Trailer Music - Pokémon Sun and Moon,2016-02-25 23:52:27+00:00
703004607954333696,Well then. The Pokémon Sun and Moon thing is (most likely) fake. :| https://t.co/PRkc8i3OK4,2016-02-25 23:52:14+00:00
703004585099726848,I can't wait 'till Pokemon direct for #Pokemon Sun and Moon https://t.co/2u4jWphAAD,2016-02-25 23:52:08+00:00
703004577667239937,I'm dead. 󾌧 https://t.co/qOs7Tg28NP,2016-02-25 23:52:07+00:00
703004536382709761,So Pokemon Sun and Moon! Perhaps we'll go see the Clefairy planet!,2016-02-25 23:51:57+00:00
703004481693343744,Pokemon Moon Stone and Pokemon JorSUN. #TPPDiscord,2016-02-25 23:51:44+00:00
703004239791071232,I added a video to a @YouTube playlist https://t.co/F1x2mB8b8C POKEMON SUN AND MOON?! Discussion w/ Aggronix &amp; Jay,2016-02-25 23:50:46+00:00
703004238603907072,I don't know anything about the games but I would go Pokemon Moon because Moon,2016-02-25 23:50:46+00:00
703004210741297152,"So what'll be the tertiary version for Pokemon Sun and Moon?

Pokemon Black Hole Sun.",2016-02-25 23:50:39+00:00
703004210166702080,Pokemon Sun And Moon is very interesting :3,2016-02-25 23:50:39+00:00
703004146681683968,I think Pokemon Sun.. is a must have for me...,2016-02-25 23:50:24+00:00
703004142948626432,Wait is the Pokemon Moon and Sun thing real?,2016-02-25 23:50:23+00:00
703003950866427905,I liked a @YouTube video https://t.co/TLc58vs6gN New Pokemon Games Leaked | Pokemon Moon &amp; Pokemon Sun,2016-02-25 23:49:37+00:00
703003927869005825,Pokémon Sun and Moon aren't even legit yet but I already know I'll be buying Moon.,2016-02-25 23:49:32+00:00
703003920851996672,GS News - World of Tanks Developer Becomes Billionaire; New Pokemon Sun and Moon Games; Resident Evil Re-Releases … https://t.co/04VQlm3Vug,2016-02-25 23:49:30+00:00
703003903474860033,"Jesus christ now Pokemon Sun and Moon? I DON'T NEED ANOTHER GAME I'LL NEVER FINISH, I NEED GO.",2016-02-25 23:49:26+00:00
703003859267035137,https://t.co/HOegXdhbqz IM LOSING MY SHIT,2016-02-25 23:49:15+00:00
703003827704737792,Cant wait for #pokemon sun and moon announcement tomorrow i will blindly buy both as i have for the last 20 years #Nintendo #Pokemon20,2016-02-25 23:49:08+00:00
703003792057495553,I liked a @YouTube video from @ivietroid https://t.co/uQ9tgy1DsF Pokemon Sun &amp; Moon Leaked? Fake or Real? Nintendo Direct Stream,2016-02-25 23:48:59+00:00
703003784797102081,They are releasing  2 more Pokemon games; Pokemon sun and Pokemon moon... These Pokemon games are never ending,2016-02-25 23:48:58+00:00
703003755646689281,I liked a @YouTube video from @razzbowski https://t.co/MIv6PPqvER POKEMON SUN &amp; MOON Confirmed?! | NEW Evidence That May Confirm,2016-02-25 23:48:51+00:00
703003711422013440,Proasheck: when i read about pokémon sun/moon i foresaw a nightmarish game where you can only catch solrock/lunatone and... they still have…,2016-02-25 23:48:40+00:00
703003670410076161,Anthony Gamer UK talk about: Pokemon Sun and Pokemon Moon: https://t.co/ruS98eAjR5 via @YouTube,2016-02-25 23:48:30+00:00
703003629733683200,"Pokemon Sun Version: Catch SolRock
Pokemon Moon Version: Catch Lunatone

Kappa",2016-02-25 23:48:21+00:00
703003526503337984,@ffxv_prompto would play Pokemon sun,2016-02-25 23:47:56+00:00
703003473013506048,GS News - World of Tanks Developer Becomes Billionaire; New Pokemon Sun and Moon Games; Resident Evil Re-Releases https://t.co/fDCiQcBxiZ,2016-02-25 23:47:43+00:00
703003421046087680,I hope Lunatone is Pokemon Sun exclusive and Solrock is Pokemon Moon exclusive just to fuck with people.,2016-02-25 23:47:31+00:00
703003401748000768,Who thinks this is legit? Here's some more info: https://t.co/mSKcnWKWCr https://t.co/Jrquny687i,2016-02-25 23:47:26+00:00
703003354679607296,GS News - World of Tanks Developer Becomes Billionaire; New Pokemon Sun and Moon Games; Resident Evil Re-Releases https://t.co/iPEVs5A5aA,2016-02-25 23:47:15+00:00
703003320877760514,"Wait, @Pokemon Sun and Moon... 
SOLROCK AND LUNATONE MEGA EVOLUTIONS CONFIRMED",2016-02-25 23:47:07+00:00
703003252665815041,"📹 My reaction to Pokemon Sun and Moon, no time for a shirt.  https://t.co/Ty2aTK5IMd",2016-02-25 23:46:51+00:00
703003170578927616,Pokemon Moon &amp; Sun look fantastic #Pokemon https://t.co/mWlAkF6n9H,2016-02-25 23:46:31+00:00
703003158260285440,"If Pokemon Sun/Moon is real, can we get... more space-themed Pokemon...",2016-02-25 23:46:28+00:00
703003119463108608,I liked a @YouTube video from @woopsire https://t.co/gIuV2WvQUJ NURSE JOY &amp; OFFICER JENNY GET THEIR OWN GAMES?! POKEMON SUN &amp; MOON,2016-02-25 23:46:19+00:00
703003096281161728,GS News - World of Tanks Developer Becomes Billionaire; New Pokemon Sun and Moon Games; Resident Evil Re-Releases :https://t.co/KJUPguzwTF,2016-02-25 23:46:13+00:00
703003076966424576,We kick off Pokémon Sun and Moon to bring you Touhou Subterranean Animism and Legacy of Lunatic Kingdom. https://t.co/s2LRbt9MlP,2016-02-25 23:46:09+00:00
703003076353888256,Forget Pokemon Sun and Moon. That big announcement is gonna be that Detective Pikachu's voice is Danny Devito.,2016-02-25 23:46:09+00:00
703003066581323776,"@Pokemon Wait, NEW Pokemon adventure 
POKEMON SUN AND MOON CONFIRMED",2016-02-25 23:46:06+00:00
703003042808012804,OMG these rumors of Pokémon Sun and Moon are making me crazy! If these rumors are true then I'll freak out!,2016-02-25 23:46:01+00:00
703003015574323200,What if Pokemon Sun and Moon are set in space,2016-02-25 23:45:54+00:00
703002976835805184,📷 gamefreaksnz: Pokémon Moon and Sun leaked Nintendo is set to announce some big news for the Pokemon... https://t.co/hNpapd3Y1A,2016-02-25 23:45:45+00:00
703002958959513600,Pokemon Sun and Moon trademarks leak ahead of Nintendo Direct https://t.co/dtdRVrLmmy,2016-02-25 23:45:41+00:00
703002952089280512,Pokemon Sun Moon Lake. Featuring Taiwan 日月潭.,2016-02-25 23:45:39+00:00
703002914667671552,rumors of Pokemon Sun and Pokemon Moon is making me feel the hype with loneliness that my existence is nothing but a black hole of misery,2016-02-25 23:45:30+00:00
703002734061084672,"Pokemon Sun and Moon? Really? Your taking Megaman Battle Network 4 titles? Though that may not be a bad thing, lol https://t.co/6mzIwSkfQn",2016-02-25 23:44:47+00:00
703002597742010368,Soundtrack von Pokemon SM confirmt. https://t.co/tGyVhmTlu1 #pokemon #Pokemon20 #PokemonSun #PokemonMoon #PokemonDirect #PokemonSunAndMoon,2016-02-25 23:44:15+00:00
703002583950950400,"POKEMON SUN AND POKEMON MOON HYPE!

*is like a kit a Christmas right now* =D",2016-02-25 23:44:11+00:00
703002561461157888,All Aboard!!! #Pokemon #pokemonsun #PokemonMoon https://t.co/a7aKNii8Ju,2016-02-25 23:44:06+00:00
703002561394057217,Could those rumors about Pokémon Sun and Moon be real? 😍❤️ #lovedthenames #pokemon If you know me you know which one I'd obviously choose🌙✨,2016-02-25 23:44:06+00:00
703002560718729216,Pokemon Sun and Pokemon Moon Incoming https://t.co/2eISucIb7X https://t.co/sDkp1aCm4a,2016-02-25 23:44:06+00:00
703002493404319744,The only thing that could make me hate pokemon sun and Moon would be if the mascots were just spheres,2016-02-25 23:43:50+00:00
703002466921672704,Pokemon Is Back With Pokemon SUN &amp; MOON! https://t.co/81iKovGuLR #quiz #play,2016-02-25 23:43:43+00:00
703002440610615296,So... Pokemon Moon &amp; Sun..,2016-02-25 23:43:37+00:00
703002436227735556,I'm thinking that the mascot legendaries for Pokemon Sun and Moon will be Fire/Fairy and Dark/Water respectively,2016-02-25 23:43:36+00:00
703002406393491456,idc guys I want Pokemon Moon,2016-02-25 23:43:29+00:00
703002334910136320,GS News - World of Tanks Developer Becomes Billionaire; New Pokemon Sun and Moon Games… https://t.co/AhylujwxhZ,2016-02-25 23:43:12+00:00
703002328496910336,"POKEMON SUN AND MOON, HYPED",2016-02-25 23:43:10+00:00
703002200029728770,"The only thing I really want out of Pokemon Sun and Moon is just additional new set of Pokemon. Not just legendaries, a good 50+ more.",2016-02-25 23:42:40+00:00
703002106458972160,Pokémon 'Sun' and 'Moon' should debut on February 26th https://t.co/TT0Q8YXMes,2016-02-25 23:42:17+00:00
703002069712506880,Pokemon Company registering Pokemon Sun and Dawn trademarks hnnnggggg new game!,2016-02-25 23:42:09+00:00
703002024770707456,I liked a @YouTube video from @razzbowski https://t.co/rh40TCWVya POKEMON SUN &amp; MOON Confirmed?! | NEW Evidence That May Confirm,2016-02-25 23:41:58+00:00
703002016629391366,fuck Pokemon sun and moon.....gimme Pokemon Twilight instead,2016-02-25 23:41:56+00:00
703002008777682945,"@staringispolite leaked info: new gen of pkmn https://t.co/Dtx2s5ta5F
possible pkmn go news",2016-02-25 23:41:54+00:00
703002003664822272,GS News - World of Tanks Developer Becomes Billionaire; New Pokemon Sun and Moon Games; Resident Evil... https://t.co/LLUCV6BVC4,2016-02-25 23:41:53+00:00
703001957439512576,"@Pokemon what do you have to say about Pokemon Moon and Pokemon Sun?
#PokemonMoon #PokemonSun #pokemon #Pokemon20 https://t.co/owx0dgM2WP",2016-02-25 23:41:42+00:00
703001947012333568,Pokemon Sun and Moon trademarks leak ahead of Nintendo Direct #PokemonSunandMoon https://t.co/mOHmiNOlDI #PokemonSunandMoon,2016-02-25 23:41:39+00:00
703001943015292928,I liked a @YouTube video from @nintendome https://t.co/y16rTB35J7 Splatoon Nintendo Live Stream - Pokemon Sun &amp; Pokemon Moon? for,2016-02-25 23:41:39+00:00
703001929715228672,Ik vind een @YouTube-video van @razzbowski leuk: https://t.co/aTj1vMBXPZ POKEMON SUN &amp; MOON Confirmed?! | NEW Evidence That May,2016-02-25 23:41:35+00:00
703001838937714688,13 things you'll know if you grew up in Knaresborough #PokemonSunandMoon #PokemonSunandMoon https://t.co/EVPaQKQJZg https://t.co/ymhHkpzx2p,2016-02-25 23:41:14+00:00
703001824303804416,"Pokemon Sun and Moon? Yes please! I NEED a new Pokemon game @NintendoAUNZ 
#Pokemon #Nintendo #spoilers #NintendoDirect",2016-02-25 23:41:10+00:00
703001785963667456,ok but is pokemon sun and moon real... like i have yet to see a solid confirmation,2016-02-25 23:41:01+00:00
703001718431289345,I liked a @YouTube video from @siivagunner https://t.co/6EFIEi0AbR Direct Reveal Trailer Music - Pokémon Sun and Moon,2016-02-25 23:40:45+00:00
703001497513005056,IS POKEMON SUN MOON OFFICIAL?? ITS NOT A HOAX??? SOMEONE TELL ME THE TRUTH I DID NOT JUST WAKE UP 4 AM FOR THIS,2016-02-25 23:39:52+00:00
703001444870283264,What if Pokemon Sun and Moon focused more on the day and night mechanic. That would be really fun!!,2016-02-25 23:39:40+00:00
703001380659662848,SO..... THIS. #PokemonMoon #PokemonSun https://t.co/jGBjB6fOyk,2016-02-25 23:39:24+00:00
703001346878914560,I liked a @YouTube video from @siivagunner https://t.co/xzArE6cEYA Direct Reveal Trailer Music - Pokémon Sun and Moon,2016-02-25 23:39:16+00:00
703001339459039232,GS News - World of Tanks Developer Becomes Billionaire; New Pokemon Sun and Moon Games; Resident Evil Re-Relea... https://t.co/PP2oPBTq10,2016-02-25 23:39:15+00:00
703001320530305024,POKEMON SUN &amp; POKEMON MOON are Actually THREE GAMES! https://t.co/jWpweG3kDU,2016-02-25 23:39:10+00:00
703001281909149696,I liked a @YouTube video from @acetrainerliam https://t.co/rY6q9y0zxH POKÉMON SUN AND MOON: NEW NINTENDO TRADEMARK = NEW GAME?,2016-02-25 23:39:01+00:00
703001241844973568,"If pokemon sun and moon are legit and gen 7s, do we get to see who the newest hottest starter would be soon",2016-02-25 23:38:51+00:00
703001237533409281,"Pokemon moon and sun, and I just think about this (I need teraphy): https://t.co/I9CzhocdZw",2016-02-25 23:38:50+00:00
703001229354536960,"Friends, what if Pokemon Sun/Moon are all an elaborate hoax?",2016-02-25 23:38:48+00:00
703001181782540289,GS News - World of Tanks Developer Becomes Billionaire; New Pokemon Sun and Moon Games; Resident Evil Re-Relea... https://t.co/WS1viEmatS,2016-02-25 23:38:37+00:00
703001172961939457,Gamespot - Pc GS News - World of Tanks Developer Becomes Billionaire; New Pokemon Sun and Moon Games; Resident... https://t.co/QXQcJdDL8w,2016-02-25 23:38:35+00:00
703001168922804226,GS News - World of Tanks Developer Becomes Billionaire; New Pokemon Sun and Moon Games; Resident Evil Re-Releases https://t.co/kQ91AAHOwV,2016-02-25 23:38:34+00:00
703001165236039680,GS News - World of Tanks Developer Becomes Billionaire; New Pokemon Sun and Moon Games; Resident Evil Re-Relea... https://t.co/XNSgQxvW36,2016-02-25 23:38:33+00:00
703001161205288960,GS News - World of Tanks Developer Becomes Billionaire; New Pokemon Sun and Moon Games; Resident Evil Re-Releases https://t.co/6qgGhAJNqm,2016-02-25 23:38:32+00:00
703001157820547072,GS News - World of Tanks Developer Becomes Billionaire; New Pokemon Sun and Moon Games; Resident Evil Re-Releases https://t.co/Emin3qhW2y,2016-02-25 23:38:31+00:00
703001154725158913,Pokemon Sun and Moon daw,2016-02-25 23:38:31+00:00
703001119912427520,So..... pokemon Sun and Moon?,2016-02-25 23:38:22+00:00
703001118150893569,when i read about pokémon sun/moon i foresaw a nightmarish game where you can only catch solrock/lunatone and... they still have no evo D:!!,2016-02-25 23:38:22+00:00
703001098412425216,o H AMAZING POKEMON MOON AND SUN I CANT WAIT TO SEE THE NEW POKEMONS,2016-02-25 23:38:17+00:00
703001012873736193,"Pokemon Sun and Moon spoilers
I'll cry over one song in the game being beyond beautiful",2016-02-25 23:37:57+00:00
703001001733824512,@Pharaoh2091 Two trademarks and logos were found this morning for Pokemon Sun and Moon. A Pokemon-centered Nintendo Direct is tomorrow.,2016-02-25 23:37:54+00:00
703000946364825600,I DONT KNOW IF POKEMOONMOON AND POKEMON SUN ARE FAKE OR NOT BUT IM ENJOYING THE EDITS,2016-02-25 23:37:41+00:00
703000917944172545,Praying to God Almighty that Pokemon Sun and Moon are new generation games. Please for all that's friggin' holy... Please please please,2016-02-25 23:37:34+00:00
703000882774933505,"Calling it now.. Solrock, the pokemon that looks like a sun, is going to be a ""Pokemon Moon"" exclusive, and vice versa with lunatone.",2016-02-25 23:37:26+00:00
703000864881905664,A Nintendo Parody Account Is Tricking Outlets Into 'Confirming' Pokémon Sun And Moon - https://t.co/h917XYiApj https://t.co/8RQ5CH67hD,2016-02-25 23:37:21+00:00
703000864131313664,GS News - World of Tanks Developer Becomes Billionaire; New Pokemon Sun and Moon Games; Resident... https://t.co/MFXFQwFzq0,2016-02-25 23:37:21+00:00
703000818702753792,@Truegreen7 maybe Pokemon Sun and Moon are prequels to X and Y. Who knows tbh.,2016-02-25 23:37:10+00:00
703000799673245696,@midnight PRAISE THE SUN! #PokemonSun #PraiseTheSun https://t.co/wn6cXMOn3Y,2016-02-25 23:37:06+00:00
703000788927270912,#Pokemon Sun and Moon 😲😲😲😲😲,2016-02-25 23:37:03+00:00
703000712125489153,I liked a @YouTube video from @acetrainerliam https://t.co/SvuMjNW8TR POKÉMON SUN AND MOON: NEW NINTENDO TRADEMARK = NEW GAME?,2016-02-25 23:36:45+00:00
703000687181860864,".@Pokemon Sun And Moon Logos Appear Online
@Nintendo @NintendoAmerica #PokemonSunAndMoon #PokemonMoon #PokemonSun 
https://t.co/PrBR2Z7hEi",2016-02-25 23:36:39+00:00
703000660598497280,"Pokemon Moon Moon
You can thank me later.",2016-02-25 23:36:33+00:00
703000655552614400,"Pokemon sun and pokemon moon, new clear song, league mount targon update
what's next
''your homeworks''
fucc",2016-02-25 23:36:32+00:00
703000643619966976,Pokemon Moon's theme is so good https://t.co/u7bKaN7ZLP,2016-02-25 23:36:29+00:00
703000536010731520,GS News - World of Tanks Developer Becomes Billionaire; New Pokemon Sun and Moon Games; Resident Evil Re-Relea... https://t.co/zHQOdV1AlE,2016-02-25 23:36:03+00:00
703000451634044928,I liked a @YouTube video from @razzbowski https://t.co/7v8344ywky POKEMON SUN &amp; MOON Confirmed?! | NEW Evidence That May Confirm,2016-02-25 23:35:43+00:00
703000339453186050,I liked a @YouTube video from @smkgaming05 https://t.co/50PIVowJqC UNCONFIRMED POKEMON NEWS! Pokemon Sun and Pokemon Moon | New Gen 7,2016-02-25 23:35:16+00:00
703000203545149440,I have a feeling that Pokemon Z will be announced tomorrow &amp; that Pokemon Sun and Moon are Gen 7 games. We can't possibly be done with Kalos,2016-02-25 23:34:44+00:00
703000003250397186,"@MicaBurton came for the Pokemon sun moon memes, stayed for the pretty person",2016-02-25 23:33:56+00:00
