tweet id,text,created at
702904085591142400,@GalacticElliot @aDrive_tK If Pokemon Sun and Pokemon Moon are real....you think the new villains should be Team Sol and Team Luna?,2016-02-25 17:12:47+00:00
702904072911855617,Pokémon 'Sun' and 'Moon' should debut on February 26th https://t.co/tJgKUObstG #Technology #technews #puledo_tech_update,2016-02-25 17:12:44+00:00
702903981299929088,@TyranitarTube I did notice alot of ice and dark pokemon (moon) . Which as a fan of dark pokemon I love it,2016-02-25 17:12:23+00:00
702903959003009024,"YO pokemon sun and pokemon moon??? That sounds super dope, I'm ready",2016-02-25 17:12:17+00:00
702903957488848896,Probably going to want Pokémon Sun and Moon,2016-02-25 17:12:17+00:00
702903955651624960,A Nintendo Parody Account Is Tricking Outlets Into ‘Confirming’ Pokémon Sun And Moon – Forbes: ForbesA Nintend... https://t.co/WVuRnGcloB,2016-02-25 17:12:17+00:00
702903955232149504,@TyranitarTube Pokemon sun looks like the ring around arceus and Pokemon moon looks like the head of giratina @WeAreMajorMeme,2016-02-25 17:12:16+00:00
702903928942366721,Rumor: @Pokemon Sun and Moon to be announced tomorrow during the 10am EST Nintendo Direct. https://t.co/cUVK3EoqkI,2016-02-25 17:12:10+00:00
702903902178578432,"OMG please tell me Pokemon Moon and Sun will actually be a thing, the titles sound amazing and very mysterious!! *O* https://t.co/u83Imvx8SB",2016-02-25 17:12:04+00:00
702903894238633984,"Wakes up to Pokemon Sun/Moon news. I'll believe it when I see it. Otherwise, we're still in a dry season of Pokemon.",2016-02-25 17:12:02+00:00
702903880959393794,Pokemon Sun and Moon? Quite possibly. https://t.co/tJONrLJ8FS,2016-02-25 17:11:59+00:00
702903864924594176,*blows kiss at pokemon sun*,2016-02-25 17:11:55+00:00
702903862701727744,"superrobert: If Pokemon Sun &amp; Moon is real, we’ll all be saying Pokemon S&amp;M and idk how to feel about that https://t.co/TfzpeEPnWf",2016-02-25 17:11:54+00:00
702903850332758016,I havent even finished X &amp; Y ughghghhhh https://t.co/nXHjcafVoa via @Polygon,2016-02-25 17:11:51+00:00
702903848113836036,@IdioticSenpapi Plot for Pokemon Moon: the moon gets blown up,2016-02-25 17:11:51+00:00
702903844926267392,Pokemon Sun and Moon klingt nice,2016-02-25 17:11:50+00:00
702903821874421761,Rumor is that the next #pokemon for #Generation7 will be Pokemon Sun and Moon after being leaked on Europe scan https://t.co/M8BdTIqz4n,2016-02-25 17:11:45+00:00
702903805168386048,I liked a @YouTube video from @nikoamii https://t.co/mQgZWpZQWR Pokemon Sun and Pokemon Moon LEAK!! | Niko Amii,2016-02-25 17:11:41+00:00
702903789360189440,"@_Nickelnuts_ it's gonna be an adventure 
https://t.co/oGXSsQaDlD",2016-02-25 17:11:37+00:00
702903732573507584,"Sun and Moon could happen, but getting a 3rd Kalos game makes a lot more sense. #Pokemon #PokemonDirect #PokemonSun #PokemonMoon",2016-02-25 17:11:23+00:00
702903703800520710,"CONFIRMED!!!! Pokemon Sun and Moon! #Pokemon 

https://t.co/5Ql9JlbOXu

~Mike",2016-02-25 17:11:16+00:00
702903694342270976,"hype for pokemon sun and moon, not sure what they might me though",2016-02-25 17:11:14+00:00
702903660523757568,"@PhillyD You gotta mention Pokemon Moon &amp; Sun, &amp; how you will be disappearing to play them when they come out! https://t.co/PWp5YcOb4H",2016-02-25 17:11:06+00:00
702903646615420928,POKEMON MOON THEME SONG LEAKED https://t.co/ZRqNKDFRJC,2016-02-25 17:11:03+00:00
702903608669396996,Plot twist: Pokémon Sun and Moon features mega evolutions for Espeon and Umbreon. (PSA: unconfirmed next main titles btw),2016-02-25 17:10:54+00:00
702903608245919744,"@EtikaWNetwork This is one small step for hype, and one giant leap for more hype!!
Pokemon Moon and Sun!!",2016-02-25 17:10:54+00:00
702903554252652544,Pokemon Moon? Mega Cresselia sounds fun tbh [:,2016-02-25 17:10:41+00:00
702903459201335296,"@EtikaWNetork This is one small step for hype, and one giant leap for more hype!!
Pokemon Moon and Sun!!",2016-02-25 17:10:18+00:00
702903451479486464,I need a box of pokemon sun and moon with solrock and lunatone on them,2016-02-25 17:10:16+00:00
702903446995902465,@pk1364 have you seen all the stuff about POKEMON SUN AND MOON,2016-02-25 17:10:15+00:00
702903423759417345,Pokemon Sun and Moon https://t.co/tiI27u9A3f,2016-02-25 17:10:10+00:00
702903423268556801,A Nintendo Parody Account Is Tricking Outlets Into 'Confirming' Pokémon Sun And Moon - Forbes https://t.co/xtfOZRchUa,2016-02-25 17:10:10+00:00
702903397758980096,I liked a @YouTube video from @numbnexus https://t.co/hUpOo6ukhd UHH SO NEW POKEMON MOON &amp; SUN GAMES TRADEMARKED WHAT DOES THIS MEAN?,2016-02-25 17:10:03+00:00
702903375889731584,Pokemon Sun and Pokemon Moon Trademark Filings Discovered https://t.co/vGxf4aYaM4 #Pokemon #Videogames https://t.co/UwjmiOzMN6,2016-02-25 17:09:58+00:00
702903358571442176,I have a feeling that Pokemon Sun/moon is real.,2016-02-25 17:09:54+00:00
702903334399684608,"Pokemon Sun &amp; Moon sound so 'whatever' for me.
That i bet, it's just a hoax. ""IT'S JUST A PRANK BRO""",2016-02-25 17:09:48+00:00
702903326883512320,I hope this true that New Gen pokemon game. Pokemon Sun &amp;Moon is the new game.,2016-02-25 17:09:47+00:00
702903322529894400,Plot for Pokemon sun: The sun comes too close to earth,2016-02-25 17:09:46+00:00
702903276430368768,Looks like we could be hearing something about a new Pokemon game titled Pokemon Moon &amp; Pokemon Sun tomorrow. -G,2016-02-25 17:09:35+00:00
702903264015216640,Pokemon Sun and Moon https://t.co/qNgdiyFb2r,2016-02-25 17:09:32+00:00
702903238396235776,@tokogt how many days til Pokemon Sun?,2016-02-25 17:09:26+00:00
702903209489117184,Pokemon Sun and Moon? We have come full circle. https://t.co/96XiCMzpIA,2016-02-25 17:09:19+00:00
702903206771367936,Kéké came up with Pokemon Sun and Moon 6 years before it was cool https://t.co/CfNZhSlWLp,2016-02-25 17:09:18+00:00
702903121110958080,"Predictions for #PokemonSun and #PokemonMoon. South American influence coming from Mayans, Aztecs, etc #PokemonDirect",2016-02-25 17:08:58+00:00
702903094296838144,"So if we get Pokemon Sun and Moon, does that mean the third game will be a long-awaited Resident Evil crossover?",2016-02-25 17:08:51+00:00
702903072893378561,Pokemon Sun and Moon. Alright.,2016-02-25 17:08:46+00:00
702903057286234114,This makes me feel some type of way https://t.co/eQWtv1l6V7,2016-02-25 17:08:42+00:00
702902982258524161,Nintendo Will Announce Pokémon Sun and Moon Tomorrow https://t.co/tvXuPdlswi,2016-02-25 17:08:24+00:00
702902913547542528,Pokemon Moon and Sun. Interesting.,2016-02-25 17:08:08+00:00
702902908229132289,"Guys, I think I've uncovered the mascot of Pokémon Moon! :P https://t.co/HejE58DI4f",2016-02-25 17:08:07+00:00
702902907486736384,"@ArianaGrande hey, did you heard about ""pokemon moon""? Its so... You! 🌘",2016-02-25 17:08:07+00:00
702902895944081408,look all I'm saying is if they make a Pokemon Moon game and don't have some sweet hair and sailor fuku options... https://t.co/y3UEGESD4z,2016-02-25 17:08:04+00:00
702902864553730048,//Pokemon Sun and Moon huh? Sounds kinda neat. We're getting a new gen I guess,2016-02-25 17:07:56+00:00
702902859797385216,Pokemon Sun and Moon can we please have this?!!? SO FREAKING EPIC!! I think I am going to lose it,2016-02-25 17:07:55+00:00
702902808295694338,"Do you guys think that Pokemon Sun and Moon (and maybe Pkmn Z, if possible) might be the new Gen 7? (idkhowtosayit)",2016-02-25 17:07:43+00:00
702902796283150336,Pokemon sun and moon? Ah gosh.,2016-02-25 17:07:40+00:00
702902737873346560,Pokemon Sun &amp; Moon thoughts:  sorta bummed in a way unless it uses the extra power of the New3DS. That engine struggles w/frame rate on 3DS.,2016-02-25 17:07:26+00:00
702902721079283712,I liked a @YouTube video from @woopsire https://t.co/3Q1ZOqda2S NURSE JOY &amp; OFFICER JENNY GET THEIR OWN GAMES?! POKEMON SUN &amp; MOON,2016-02-25 17:07:22+00:00
702902720450007040,New post: #3ds #av #Games #Gaming #Nintendo Pokémon ‘Sun’ and ‘Moon’ should debut on February 26th https://t.co/hMy0N24NQ5,2016-02-25 17:07:22+00:00
702902711725862912,i hope pokemon sun and moon are sequels to pokemon red and blue where you play as ash and gary as they go to the sun and moon respectively,2016-02-25 17:07:20+00:00
702902709851070464,Pokemon sun and moon LOL they are running out of ideas,2016-02-25 17:07:19+00:00
702902677638787072,The first second I saw the names Pokemon Sun and Moon I thought @Lystrialle 's aesthetic has come true.,2016-02-25 17:07:12+00:00
702902652019937280,Pokemon Moon and Pokemon Red Moon Which Is Full of Monsters,2016-02-25 17:07:06+00:00
702902618150940672,@pceleb Pokémon 'Sun' and 'Moon' should be announced on February 26th https://t.co/tnM4ckfkQG via @engadget,2016-02-25 17:06:58+00:00
702902561452527616,"C'mon Guys, Pokémon Sun And Moon Has Been Leaked For Almost 4.6 Billon Years https://t.co/0tfqhTrap4",2016-02-25 17:06:44+00:00
702902546357219328,Pokemon sun and moon yeah?,2016-02-25 17:06:41+00:00
702902537272229888,#Pokemon Sun☀️ &amp; Moon🌙? I'm ready to jump back into my favorite game franchise! I wish it wasn't on the 3ds though #upgrade the hardware.👾,2016-02-25 17:06:38+00:00
702902507622813697,I'm soooo looking forward for Pokémon Moon. https://t.co/K3XYvdYV4S,2016-02-25 17:06:31+00:00
702902501889044480,POKEMON SUN AND MOON????,2016-02-25 17:06:30+00:00
702902477377675266,"When Pokémon Sun and Moon actually gets announced tomorrow, I'll be like! https://t.co/gaPjQNDLwh",2016-02-25 17:06:24+00:00
702902472034144257,rlly hope pokemon sun &amp; moon (if real) are gen 1 remakes in an x/y engine,2016-02-25 17:06:23+00:00
702902461607059457,Rumor: the next Pokémon games will be called #PokemonSun and #PokemonMoon. What's your appreciation of these names?,2016-02-25 17:06:20+00:00
702902458415054849,"@NightStarX99 I'm expecting fanart of Luna playing Pokémon Sun, and Celestia playing Pokémon Moon. And them trading pokemon with eachother~",2016-02-25 17:06:20+00:00
702902457026912256,I liked a @YouTube video from @mulvone19 https://t.co/twdcT17u1E POKEMON SUN AND MOON ARE THE NEW POKEMON GAMES?!? NEW TRADEMARKS!,2016-02-25 17:06:19+00:00
702902454384517121,"Pokemon Sun and Moon

Well, we went to SPACE in OR/AS, so we'd better actually be going to these places.....",2016-02-25 17:06:19+00:00
702902419097829377,POKEMON SUN🌝 AND MOON🌚 ARE YOU JOKING MEEEE,2016-02-25 17:06:10+00:00
702902400508522498,"Here's the new legendary for #PokemonMoon, Crater Face!!! https://t.co/9davp0gNns",2016-02-25 17:06:06+00:00
702902391897608192,"It.. IT'S REAL RIGHT?

https://t.co/qkPTMa0hTA",2016-02-25 17:06:04+00:00
702902374273261568,POKEMON SUN AND MOON LEAKED!! | NEW GEN 6.5 OR GEN 7 POKEMON GAMES?? https://t.co/TtyL8lJWob via @YouTube,2016-02-25 17:05:59+00:00
702902371714768896,"Pokémon Sun &amp; Moon leaked before the Pokémon Direct, still worth a look at https://t.co/OHJqgSpdsC tmrw at 7 a.m. PT https://t.co/WVlRcRCEhF",2016-02-25 17:05:59+00:00
702902363615535104,"If Pokemon Sun and Moon is real, not gonna lie, I'll be slightly disappointed that there was no XY remake, those games need polishing.",2016-02-25 17:05:57+00:00
702902330790912000,did you all se that nintendo copywrighted pokemon moon and sun :D hype,2016-02-25 17:05:49+00:00
702902307915227136,#PokémonMoon And #PokémonSun Logos Pop Up https://t.co/dGqRhWnT7X https://t.co/rUSIYQV2yg,2016-02-25 17:05:44+00:00
702902271709835264,HOLY SHIT POKEMON SUN AND MOON HOLY FUCK,2016-02-25 17:05:35+00:00
702902252449693696,"Pokemon Sun and Moon could be coming, but Nintendo isn't confirming it https://t.co/8YayN8tBwh",2016-02-25 17:05:30+00:00
702902245780803584,@PhillyD Pokemon 20th anniversary and maybe even the pokemon moon and sun leaks,2016-02-25 17:05:29+00:00
702902200553484288,@MyNintendoNews  @NintendoAmerica  @pokemon @nintendo @GameXplain there is rumors about 7 gen is gonna be Pokemon Sun &amp; Pokemon Moon :/,2016-02-25 17:05:18+00:00
702902156920115200,@Arekkz @Chaheezor Theme song for pokemon sun revealed https://t.co/oDIpEtmxP6 pokemon moon https://t.co/AeOH8CvmdV,2016-02-25 17:05:08+00:00
702902143280402434,@nataliereed84 pokemon moon &amp; pokemon big pizza pie,2016-02-25 17:05:04+00:00
702902131276320773,Pokemon Sun and Moon versions.. looks fishy.,2016-02-25 17:05:02+00:00
702902102058729472,I liked a @YouTube video from @numbnexus https://t.co/yeaXvvf1e5 UHH SO NEW POKEMON MOON &amp; SUN GAMES TRADEMARKED WHAT DOES THIS MEAN?,2016-02-25 17:04:55+00:00
702902080147726337,‘Pokemon Sun’ And ‘Moon’ Leaked Ahead Of Nintendo Direct Announcement - https://t.co/6aeCRF6MMh https://t.co/cNwaQndYkz,2016-02-25 17:04:49+00:00
702902053698273280,Pokemon Moon all the way,2016-02-25 17:04:43+00:00
702902032978542596,"Pokemon Sun and Moon found on European trademarking site 
https://t.co/hJJDHAB5wp #Pokemon",2016-02-25 17:04:38+00:00
702902012703338496,"superrobert: If Pokemon Sun &amp; Moon is real, we’ll all be saying Pokemon S&amp;M and idk how to feel about that https://t.co/SsHA2wRTBe",2016-02-25 17:04:33+00:00
702902012325847040,Looks like @Lt_Mudkipz can finally get his left nipple back if Pokemon Sun and Moon are revealed tomorrow.,2016-02-25 17:04:33+00:00
702902011268833284,@teal_goodra  I had literally made a post about that earlier today lol. https://t.co/FkozRR48c2,2016-02-25 17:04:33+00:00
702902010333552645,"Please let Pokemon Sun and Moon be legitimate! I mean, in XY one character in Anistar mentions a ""moondial"" or something.",2016-02-25 17:04:33+00:00
702901986082078720,@nataliereed84 pokemon moon &amp; pokemon New York City,2016-02-25 17:04:27+00:00
702901984119029765,Pokemon Sun and Moon! I really hope this leak is legit,2016-02-25 17:04:26+00:00
702901947389444096,"Pokemon Sun will take place in the sun
and pokemon moon will take place in the moon",2016-02-25 17:04:18+00:00
702901900841263104,Which game you guys think will be the best and why is it pokémon moon?,2016-02-25 17:04:07+00:00
702901897703739392,A Nintendo Parody Account Is Tricking Outlets Into 'Confirming' Pokémon Sun And Moon - Forbes https://t.co/VVtBS0S277,2016-02-25 17:04:06+00:00
702901880201023488,@amaringos Pokemon sun+moon is actually a registered trademark tho https://t.co/QLAO6D0KDf,2016-02-25 17:04:02+00:00
702901865818755072,"Pokemon sun, pokemon moon and third version, pokemon spoon",2016-02-25 17:03:58+00:00
702901855513350145,Pokemon Sun &amp; Moon will be set in India.,2016-02-25 17:03:56+00:00
702901853428649984,@NintendoAmerica Can't wait for Pokemon Sun and Pokemon Moon!,2016-02-25 17:03:55+00:00
702901820713246721,A Nintendo Parody Account Is Tricking Outlets Into 'Confirming' Pokémon Sun And Moon https://t.co/wGSDm7TWT4 via #Tashify.com #MavoTV.com,2016-02-25 17:03:47+00:00
702901820625178624,I liked a @YouTube video from @hoodlumscrafty https://t.co/fRo8WIDtjs pokemon moon and sun,2016-02-25 17:03:47+00:00
702901812819406849,"Pokemon Sun and Moon huh? My guess is that they're new expansions for the TCG, especially based on how the logos look.",2016-02-25 17:03:46+00:00
702901761846083585,Pokemon sun and moon are going to be announced tmrw. You heard it here first,2016-02-25 17:03:33+00:00
702901708209397760,"@JJSamuel90 @PhillyD Gen 7 got leaked today. Supposed titles are ""Pokemon Sun"" and ""Pokemon Moon""",2016-02-25 17:03:21+00:00
702901702001872899,@RandomTBush Did you hear the rumor about Pokemon Sun and Pokemon Moon ?,2016-02-25 17:03:19+00:00
702901667453411329,"Very interesting, according to a European Union trademark filing by #Nintendo, the next two games in the #Pokemon... https://t.co/7lhj2q1RDD",2016-02-25 17:03:11+00:00
702901635794788354,"So Detective Pikachu trended but not Pokémon Sun and Moon
wat
I guess after the reveal trailer tomorrow",2016-02-25 17:03:03+00:00
702901610058534912,I liked a @YouTube video from @hoodlumscrafty https://t.co/xKh5SxnOFo pokemon moon and sun,2016-02-25 17:02:57+00:00
702901584771096577,New Pokemon Games are on the Way! Pokemon Sun and Pokemon Moon https://t.co/KXG9CHmcoP on @bloglovin,2016-02-25 17:02:51+00:00
702901579129581568,nature predicted pokemon moon because the moon was out last night https://t.co/1UZmL0uzvK,2016-02-25 17:02:50+00:00
702901555830333440,"So could Pokemon Sun and Moon really be 7th gen? Because if it is, I just think it's too fucking soon too happen lol",2016-02-25 17:02:44+00:00
702901536859561984,Leaked Pokemon Sun and Moon Screenshots! https://t.co/evt5tBeeCf,2016-02-25 17:02:40+00:00
702901503430955008,@NintendoAmerica Pokemon Moon and Pokemon Sun hype lol,2016-02-25 17:02:32+00:00
702901482920812544,I've got your Pokemon moon right here... https://t.co/sBFskl21Mi,2016-02-25 17:02:27+00:00
702901468047785985,This is the #Pokemon community right now..#PokemonSun and #PokemonMoon https://t.co/b0W9HWm2lP,2016-02-25 17:02:23+00:00
702901456966426624,What if Pokemon Sun &amp; Moon had a return of Team Rocket or Team Galactic?,2016-02-25 17:02:21+00:00
702901455762501632,"This is what happens when game outlets race to be ""first"" instead of correct. https://t.co/n488cgGlxp",2016-02-25 17:02:20+00:00
702901453778722820,"This popped up on my feed. How much do you wanna bet it's filled with replies that only say ""Pokemon Sun and Moon""? https://t.co/JPPJkSQuTw",2016-02-25 17:02:20+00:00
702901451706634241,Pokemon Sun and Moon could be next https://t.co/xuGwwF4LR7 https://t.co/EHNIaPVsOv,2016-02-25 17:02:20+00:00
702901416931696641,Pokemon Moon and Sun hype!,2016-02-25 17:02:11+00:00
702901319586086912,what a missed opportunity to call the new pokemon games pokemon sun and pokemoon,2016-02-25 17:01:48+00:00
702901274014982144,Pokemon Sun and Moon! O_O,2016-02-25 17:01:37+00:00
702901220239761408,A Nintendo Parody Account Is Tricking Outlets Into 'Confirming' Pokémon Sun And Moon: A Nintendo parody accoun... https://t.co/tf2eWMUvUb,2016-02-25 17:01:24+00:00
702901192700141569,I hope these pokemon sun and moon rumors are true. I need a nee pokemon game to play 😭,2016-02-25 17:01:18+00:00
702901185959735296,A Nintendo Parody Account Is Tricking Outlets Into 'Confirming' Pokémon Sun And Moon: A Ni... https://t.co/Lz8Rk7R6o4 #EmergingTech #Tech,2016-02-25 17:01:16+00:00
702901183241953282,"@NintendoAmerica Pokemon Moon and Sun, amirite. NINTENDO IT!",2016-02-25 17:01:16+00:00
702901173011873792,A Nintendo Parody Account Is Tricking Outlets Into 'Confirming' Pokémon Sun And Moon: A Nintendo parody accoun... https://t.co/tzqBCQTt3l,2016-02-25 17:01:13+00:00
702901172097650688,"fuck yeah

https://t.co/s2mSHLojOY",2016-02-25 17:01:13+00:00
702901139583344640,RT @ForbesTech A Nintendo Parody Account Is Tricking Outlets Into 'Confirming' Pokémon Sun And Mo... https://t.co/lccOiPBPXM #Philippines,2016-02-25 17:01:05+00:00
702901103487229956,"There are sun flares, Pokemon sun and Team Flare, But what about the moon? Dual region with the sun and moondials? Gen 6.5 games, PKMN Z",2016-02-25 17:00:56+00:00
702901102270816256,@EtikaWNetwork Pokemon Sun is my mixtape,2016-02-25 17:00:56+00:00
702901093286744064,Pokemon Sun and Moon?! 7th Gen Confirmation??: https://t.co/AgB9WupNcw via @YouTube,2016-02-25 17:00:54+00:00
702901079252430848,@NintendoAmerica Pokemon sun and moon :),2016-02-25 17:00:51+00:00
702901072252248064,There have been leaks and rumors about a Pokemon Sun and Moon coming?! This better not be fake. 😳😳😳,2016-02-25 17:00:49+00:00
702901068242419712,"@enterzalman They're actually not games, but plans. They're going to make us stare at the Pokemon Sun then Pokemon Moon us while we're blind",2016-02-25 17:00:48+00:00
702901041482899458,"Pokemon Sun and Pokemon Moon?!
 Let's hope this is real!",2016-02-25 17:00:42+00:00
702901021324890112,"im supposed to be hyped up bc i just heard about pokemon sun and moon

but im not
what did the universe do to me",2016-02-25 17:00:37+00:00
702901011866894336,"Pokemon Sun- Mega Solrock, Mega Espeon
Pokemon Moon- Mega Lunatone, Mega Umbreon 
For me it's fitting",2016-02-25 17:00:35+00:00
702900987397283844,So Pokémon Sun and Moon seems to be the biggest rumour atm. I really hope it isn't true,2016-02-25 17:00:29+00:00
702900953196978176,RUMOR: Nintendo will announce Pokemon Sun  https://t.co/7t430ANe3t,2016-02-25 17:00:21+00:00
702900942895607808,Pokemon Sun and Moon? We'll see tomorrow @Pokemon_cojp,2016-02-25 17:00:18+00:00
702900919428521984,"There's Pokemon Nintendo direct tomorrow and Nintendo just trademark (w a logo) Pokemon sun and moon, if this is gen 7 i will die",2016-02-25 17:00:13+00:00
702900912117841920,"Pokémon 'Sun' and 'Moon' should debut on February 26th

https://t.co/SKTganaoBR https://t.co/nX5Z2tUPAh",2016-02-25 17:00:11+00:00
702900910289125376,Here's hoping that Pokemon Sun and Moon are more evolution and less iterative. Pokemon is silently the most repetitive franchise in gaming.,2016-02-25 17:00:10+00:00
702900898901553157,#pokemonmoon this is a team I can get behind,2016-02-25 17:00:08+00:00
702900892790427650,@silentfury007 just game journalism https://t.co/n488cgGlxp,2016-02-25 17:00:06+00:00
702900842567847936,"Pokemon Sun and Pokemon Moon are likely placeholders for a Pokemon-based astrology game, let's be real",2016-02-25 16:59:54+00:00
702900749018206208,"If Pokemon Sun &amp; Moon are real

I'm obviously going with Moon",2016-02-25 16:59:32+00:00
702900736766697472,I liked a @YouTube video from @numbnexus https://t.co/sDmVI9pOBc UHH SO NEW POKEMON MOON &amp; SUN GAMES TRADEMARKED WHAT DOES THIS MEAN?,2016-02-25 16:59:29+00:00
702900725609840641,Talking about Pokemon Sun and Moon. We use pokemon names in our sprints! We start today 52-Meowth ;) @Pokemon https://t.co/33t9YEGhl5,2016-02-25 16:59:26+00:00
702900710908628993,"So hype I can't wait for tomorrow Pokémon 'Sun' and 'Moon' should debut on February 26th

https://t.co/Gg9Bn1JcrQ",2016-02-25 16:59:23+00:00
702900709763600384,"If Pokemon Sun and Moon are a thing, my theory is they're sequels to X and Y... Somehow. We still need Zygarde's Complete Forme.",2016-02-25 16:59:23+00:00
702900677144670208,'Pokemon Sun' And 'Pokemon Moon' Trademarks Look To Have Spoiled Nintendo's Surprise - https://t.co/9E07YHXveV via https://t.co/a29gMxrGnh,2016-02-25 16:59:15+00:00
702900675479539714,Investigate claims? Verify sources? No games journalist has time for that! https://t.co/DQ1D6jtkcV via @PaulTassi,2016-02-25 16:59:14+00:00
702900663672504321,The new Pokemon Sun and Moon Look great https://t.co/oFvIpHl3eD,2016-02-25 16:59:12+00:00
702900630919258113,I liked a @YouTube video from @adrive_tk https://t.co/Der5wfGq2k Pokemon Sun and Pokemon Moon!? 7th Gen Confirmed? Pokemon Trademarks,2016-02-25 16:59:04+00:00
702900607837810688,POKEMON SUN AND FUCKING MOON????? GOOD BYE!!!! praying this isn't some sick prank. or some iPhone game. i'll be buying moon.,2016-02-25 16:58:58+00:00
702900580302376960,If Pokémon Sun and Moon are real and there is a new wolf like Pokémon in it I will name it after me~.. and another one after Moon Moon. :P,2016-02-25 16:58:52+00:00
702900568528826368,"Pokemon Sun and Moon...so what about Pokemon Mars, Jupiter, Venus, and Mercury? Do we get a Pokemon Chibi Moon too as DLC?",2016-02-25 16:58:49+00:00
702900564988919809,POKEMON SUN AND MOON OH SHIT,2016-02-25 16:58:48+00:00
702900551340654592,"@tsunette However there are official trademarks by Nintendo for ""Pokémon Sun"" and ""Pokémon Moon"" that include those logos",2016-02-25 16:58:45+00:00
702900542465396736,#Pokemon Sun and Moon! Great logos! I hope they get confirmed and we begin Gen 7 :),2016-02-25 16:58:43+00:00
702900539588214785,"So there shall be a Pokemon Moon, Eh? WELP, T'is clearly going to be mine!",2016-02-25 16:58:42+00:00
702900510844518400,Pokemon Sun and Pokemon Moon leaked. Wonder if this is the new generation or not.,2016-02-25 16:58:35+00:00
702900499142602752,Pokemon Sun and Moon leaked? Masuda is gonna be pissed,2016-02-25 16:58:32+00:00
702900434063773696,Pokemon sun belongs to team flare peeps!,2016-02-25 16:58:17+00:00
702900431069040640,"Another hint Cyrus and Team Galactic could return in #Pokemon Sun/Moon: Cyrus is fromKuros, which is Persian for Sun! Woop Woop! #sun #moon",2016-02-25 16:58:16+00:00
702900426220376065,"New pokemon games! 

#pokemon #pokemonmoon #pokemonsun #3ds #nintendo #nintendo3ds #videogame… https://t.co/PsrTuawGSz",2016-02-25 16:58:15+00:00
702900423154376704,"omg the Pokemon sun n moon thing is getting it of hand, everyone is believing it",2016-02-25 16:58:14+00:00
702900422881775616,I liked a @YouTube video from @pkmnprofessork https://t.co/9AK0N5vgBy POKEMON SUN AND MOON LEAKED!! | NEW POKEMON GAMES!!,2016-02-25 16:58:14+00:00
702900416996970497,@bulbatrivia Pokemon Sun and Moon,2016-02-25 16:58:13+00:00
702900408121856000,If Pokemon sun and moon are real; they better have cool new space designed Pokemon,2016-02-25 16:58:11+00:00
702900396960780288,"Pokemon Sun &amp; Moon, ey!? I'll be getting Pokemon Moon if that's the case. Thanks, Bayonetta! :D",2016-02-25 16:58:08+00:00
702900396004679681,@shofu POKEMON SUN AND MOON. POKEMON SUN AND MOON.,2016-02-25 16:58:08+00:00
702900392330285056,I just came to a horrible realization. So you know how I mention in my video that the logo next to Pokemon Moon looks like dark energy?,2016-02-25 16:58:07+00:00
702900387389546496,"let me guess tho

Pokemon Moon and Sun - third game? Pokemon Star. :P",2016-02-25 16:58:06+00:00
702900318506500097,im getting pokemon moon bc the moon is my planet suckrs,2016-02-25 16:57:49+00:00
702900297987977217,Pokemon Sun and Moon Still Think White Girls Can't Twerk? https://t.co/inYT7bI1ly,2016-02-25 16:57:44+00:00
702900267654598656,Pokemon Moon and Pokemon Over My Hammy,2016-02-25 16:57:37+00:00
702900264039223297,@MegaSwampertGuy team flare = pokemon sun lol,2016-02-25 16:57:36+00:00
